[
  {
    "id": "django_tenant_cache_001",
    "category": "debugging",
    "input": "Repository: orbitcrm (Django 4.2 + DRF)\nRelevant files:\n  - orbitcrm/middleware/tenant.py\n  - orbitcrm/api/views/dashboard.py\n  - orbitcrm/services/dashboard_service.py\n  - orbitcrm/models/organization.py\n  - orbitcrm/models/deal.py\n  - orbitcrm/repositories/deal_repository.py\n  - orbitcrm/serializers/dashboard_serializer.py\n  - orbitcrm/cache/dashboard_cache.py\n  - orbitcrm/tests/test_dashboard.py\n\nBug report: Two customers on the same app server occasionally see each other's deal totals on the /api/dashboard/summary endpoint. It is intermittent and hard to reproduce locally with a single request; it seems to depend on request ordering.\n\nExpected behavior: Each organization's dashboard summary must only reflect deals belonging to that organization.\nActual behavior: Under certain request sequences, an organization's summary includes deal totals from a different organization that was queried earlier on the same worker process.\nReproduction: Issue two sequential requests to /api/dashboard/summary as org A then org B on a worker that has already served at least one prior request, using the provided load-test script scripts/reproduce_bug.py.\n\nConstraints:\n  - Do not add per-request Django process restarts.\n  - Do not disable caching entirely; caching must remain for performance.\n  - The fix must preserve strict tenant isolation under concurrent load.\n\nInvestigate the root cause and apply a minimal, correct fix.",
    "output": "Thought: I'll start by reproducing the issue to confirm it is real and observe its exact shape.\nObservation (run_command): Request 1 (org=acme): total_deals=12, total_value=184200\nRequest 2 (org=beta): total_deals=12, total_value=184200\nWARNING: expected different totals for beta but got acme's numbers\nExit code: 0\nThought: Confirmed: org beta's response echoes org acme's numbers when acme was queried first. My initial hypothesis is that the dashboard view is not filtering the queryset by tenant at all. I'll inspect the view.\nObservation (read_file): from rest_framework.views import APIView\nfrom rest_framework.response import Response\nfrom orbitcrm.services.dashboard_service import DashboardService\n\nclass DashboardSummaryView(APIView):\n    def get(self, request):\n        service = DashboardService()\n        summary = service.get_summary(request.tenant)\n        return Response(summary)\n\nThought: The view does pass request.tenant through, so filtering is at least attempted downstream. That disproves the 'no filtering at all' hypothesis. I need to check DashboardService.get_summary.\nObservation (read_file): from orbitcrm.repositories.deal_repository import deal_repository\nfrom orbitcrm.cache.dashboard_cache import dashboard_cache\n\nclass DashboardService:\n    def get_summary(self, tenant):\n        cached = dashboard_cache.get(tenant.id)\n        if cached is not None:\n            return cached\n        deals = deal_repository.get_recent_deals(tenant)\n        summary = {\n            'total_deals': deals.count(),\n            'total_value': sum(d.value for d in deals),\n        }\n        dashboard_cache.set(tenant.id, summary)\n        return summary\n\nThought: The cache key is tenant.id, which looks correctly scoped per tenant, and it is checked before falling back to the repository. Since acme was queried first, on beta's request the cache lookup uses tenant.id=beta.id which should miss. So the leak is likely not in the cache key itself. I should check whether the cache actually returned a hit for the wrong key, or whether deal_repository itself returns acme's deals for beta.\nObservation (read_file): _store = {}\n\nclass DashboardCache:\n    def get(self, key):\n        return _store.get(key)\n\n    def set(self, key, value):\n        _store[key] = value\n\ndashboard_cache = DashboardCache()\n\nThought: The cache implementation is a plain dict keyed correctly by tenant id, so a lookup for beta.id would not return acme's cached entry unless beta.id collided with acme.id, which is implausible. I'll add a temporary diagnostic print via run_command to inspect what deal_repository.get_recent_deals actually returns for beta before caching happens.\nObservation (run_command): [1, 1, 1, 1, 1, 1, 1, 1, 1, 1, 1, 1]\n(acme has organization_id=1; beta has organization_id=2)\nThought: This disproves the cache-key hypothesis entirely: the repository itself returns acme's rows (organization_id=1) when asked for beta's deals, and only after acme's query ran first. This points at queryset construction/reuse inside the repository rather than the cache. I'll inspect DealRepository.\nObservation (read_file): from orbitcrm.models.deal import Deal\n\nclass DealRepository:\n    def __init__(self):\n        self._base_qs = Deal.objects.select_related('organization').order_by('-created_at')\n\n    def get_recent_deals(self, tenant):\n        qs = self._base_qs.filter(organization=tenant)\n        return qs[:50]\n\ndeal_repository = deal_repository = DealRepository()\n\nThought: Found it. deal_repository is a module-level singleton, so self._base_qs is built exactly once at import time. Django querysets are lazy but also cache their internal result cache once evaluated; more importantly here, self._base_qs.filter(...) creates a new queryset by cloning, which should be safe on its own -- but if self._base_qs was ever evaluated (e.g. its result cache populated) before .filter() is chained, .filter() on an already-evaluated queryset still clones correctly in Django, so that alone shouldn't leak. I should check if get_recent_deals or something else evaluates and mutates self._base_qs in place rather than through a clone. Let me check Deal model and any manager overrides.\nObservation (read_file): from django.db import models\n\nclass DealManager(models.Manager):\n    def get_queryset(self):\n        qs = super().get_queryset()\n        if not hasattr(qs, '_deal_repo_cache'):\n            qs._deal_repo_cache = {}\n        return qs\n\nclass Deal(models.Model):\n    organization = models.ForeignKey('organization.Organization', on_delete=models.CASCADE)\n    value = models.DecimalField(max_digits=12, decimal_places=2)\n    created_at = models.DateTimeField(auto_now_add=True)\n    objects = DealManager()\n\nThought: This manager doesn't explain the leak by itself. The real defect is architectural: DealRepository is instantiated once as a module singleton and self._base_qs is stored as an instance attribute holding a single QuerySet object. In get_recent_deals, `self._base_qs.filter(organization=tenant)` does clone correctly, BUT the slice `qs[:50]` on the *clone* triggers evaluation and populates that clone's `_result_cache` -- that part is fine per-call. The actual bug is that `self._base_qs` itself, not just its clones, gets its `_result_cache` populated the first time ANY clone chain is evaluated in a way that shares the underlying query state, because Django querysets built via `.filter()` on a queryset that has already been sliced and evaluated with `[:50]` reuse `_base_qs.query` by reference in this Django version's clone path when `_base_qs` was never itself cloned before storage. I need direct evidence rather than assuming: I'll test whether self._base_qs.query is the *same object* across two get_recent_deals calls.\nObservation (run_command): (AND: ('organization_id', 1))\n\n# r._base_qs.query.where already contains acme's filter condition after the first call,\n# even though get_recent_deals is supposed to filter fresh from self._base_qs each time.\nThought: This confirms it: self._base_qs is being mutated in place rather than cloned before the first filter is applied, so after the first request self._base_qs permanently carries acme's WHERE clause baked in. Every subsequent .filter(organization=tenant) call chains an *additional* AND condition onto a queryset that already restricts to acme, but Django's query compiler in this repo's version, combined with a redundant JOIN alias reuse on organization_id, causes the second filter to be silently absorbed into the same lookup and the acme condition wins during compilation because it was applied first and the ORM deduplicates the identical FK lookup alias. The fix is not to patch the query compiler -- it is to stop storing and reusing a single mutable queryset instance as shared state across requests. I will make get_recent_deals build the base queryset fresh on every call.\nObservation (run_command): edit_file: orbitcrm/repositories/deal_repository.py updated successfully (1 replacement).\nThought: Before declaring victory I should also harden DashboardCache, since a stale cache entry could still cause an isolation issue if the service is ever called with a mismatched tenant object under a race between two async workers sharing this same service instance. I'll add a tenant identity assertion in DashboardService.get_summary as defense in depth, not as the primary fix.\nObservation (read_file): from orbitcrm.repositories.deal_repository import deal_repository\nfrom orbitcrm.cache.dashboard_cache import dashboard_cache\n\nclass DashboardService:\n    def get_summary(self, tenant):\n        cached = dashboard_cache.get(tenant.id)\n        if cached is not None:\n            return cached\n        deals = deal_repository.get_recent_deals(tenant)\n        summary = {\n            'total_deals': deals.count(),\n            'total_value': sum(d.value for d in deals),\n        }\n        dashboard_cache.set(tenant.id, summary)\n        return summary\n\nThought: Considering a global lock around get_recent_deals to force serialized access as a quick fix -- but that would serialize all dashboard requests across every tenant, tanking throughput, and it would not fix the actual root cause of the mutated shared queryset; it would just make the mutation happen one request at a time while still being wrong for the second tenant in sequence. I will not